year,question_number,question_type,text
2011,1,OBJECTIVE,"QUESTÃO 1
Retrato de uma princesa desconhecida
Para que ela tivesse um pescoço tão fino
Para que os seus pulsos tivessem um quebrar de caule
Para que os seus olhos fossem tão frontais e limpos
Para que a sua espinha fosse tão direita
E ela usasse a cabeça tão erguida
Com uma tão simples claridade sobre a testa
Foram necessárias sucessivas gerações de escravos
De corpo dobrado e grossas mãos pacientes
Servindo sucessivas gerações de príncipes
Ainda um pouco toscos e grosseiros
Ávidos cruéis e fraudulentos
Foi um imenso desperdiçar de gente
Para que ela fosse aquela perfeição
Solitária exilada sem destino
ANDRESEN, S. M. B. Dual. Lisboa: Caminho, 2004. p. 73.
No poema, a autora sugere que
A os príncipes e as princesas são naturalmente belos.
B os príncipes generosos cultivavam a beleza da princesa.
C a beleza da princesa é desperdiçada pela miscigenação racial.
D o trabalho compulsório de escravos proporcionou privilégios aos príncipes.
E o exílio e a solidão são os responsáveis pela manutenção do corpo esbelto da princesa."
2011,2,OBJECTIVE,"QUESTÃO 2
Exclusão digital é um conceito que diz respeito às extensas camadas sociais que ficaram à margem do fenômeno da
sociedade da informação e da extensão das redes digitais. O problema da exclusão digital se apresenta como um dos
maiores desafios dos dias de hoje, com implicações diretas e indiretas sobre os mais variados aspectos da sociedade
contemporânea.
Nessa nova sociedade, o conhecimento é essencial para aumentar a produtividade e a competição global. É fundamental
para a invenção, para a inovação e para a geração de riqueza. As tecnologias de informação e comunicação (TICs)
proveem uma fundação para a construção e aplicação do conhecimento nos setores públicos e privados. É nesse
contexto que se aplica o termo exclusão digital, referente à falta de acesso às vantagens e aos benefícios trazidos por
essas novas tecnologias, por motivos sociais, econômicos, políticos ou culturais.
Considerando as ideias do texto acima, avalie as afirmações a seguir.
I. Um mapeamento da exclusão digital no Brasil permite aos gestores de políticas públicas escolherem o público-
alvo de possíveis ações de inclusão digital.
II. O uso das TICs pode cumprir um papel social, ao prover informações àqueles que tiveram esse direito negado
ou negligenciado e, portanto, permitir maiores graus de mobilidade social e econômica.
III. O direito à informação diferencia-se dos direitos sociais, uma vez que esses estão focados nas relações entre
os indivíduos e, aqueles, na relação entre o indivíduo e o conhecimento.
IV. O maior problema de acesso digital no Brasil está na deficitária tecnologia existente em território nacional, muito
aquém da disponível na maior parte dos países do primeiro mundo.
É correto apenas o que se afirma em
A I e II.
B II e IV.
C III e IV.
D I, II e III.
E I, III e IV.
2
*A0320112* ENGENHARIA GRUPO III
2011
EXAME NACIONAL DE DESEMPENHO DOS ESTUDANTES"
2011,3,OBJECTIVE,QUESTÃO 3
2011,4,OBJECTIVE,"QUESTÃO 4
A cibercultura pode ser vista como herdeira legítima Com o advento da República, a discussão sobre a questão
(embora distante) do projeto progressista dos filósofos educacional torna-se pauta significativa nas esferas dos
Poderes Executivo e Legislativo, tanto no âmbito Federal
do século XVII. De fato, ela valoriza a participação das
quanto no Estadual. Já na Primeira República, a expansão
pessoas em comunidades de debate e argumentação.
da demanda social se propaga com o movimento da escola-
Na linha reta das morais da igualdade, ela incentiva uma
novista; no período getulista, encontram-se as reformas
forma de reciprocidade essencial nas relações humanas.
de Francisco Campos e Gustavo Capanema; no momento
Desenvolveu-se a partir de uma prática assídua de trocas
de crítica e balanço do pós-1946, ocorre a promulgação
de informações e conhecimentos, coisa que os filósofos
da primeira Lei de Diretrizes e Bases da Educação
do Iluminismo viam como principal motor do progresso.
Nacional, em 1961. É somente com a Constituição de
(...) A cibercultura não seria pós-moderna, mas estaria
1988, no entanto, que os brasileiros têm assegurada a
inserida perfeitamente na continuidade dos ideais educação de forma universal, como um direito de todos,
revolucionários e republicanos de liberdade, igualdade e tendo em vista o pleno desenvolvimento da pessoa no que
fraternidade. A diferença é apenas que, na cibercultura, se refere a sua preparação para o exercício da cidadania
esses “valores” se encarnam em dispositivos técnicos e sua qualificação para o trabalho. O artigo 208 do texto
concretos. Na era das mídias eletrônicas, a igualdade se constitucional prevê como dever do Estado a oferta da
educação tanto a crianças como àqueles que não tiveram
concretiza na possibilidade de cada um transmitir a todos;
acesso ao ensino em idade própria à escolarização cabida.
a liberdade toma forma nos softwares de codificação e no
acesso a múltiplas comunidades virtuais, atravessando Nesse contexto, avalie as seguintes asserções e a relação
fronteiras, enquanto a fraternidade, finalmente, se traduz proposta entre elas.
em interconexão mundial.
A relação entre educação e cidadania se estabelece na
LEVY, P. Revolução virtual. Folha de S. Paulo. busca da universalização da educação como uma das
Caderno Mais, 16 ago. 1998, p.3 (adaptado).
condições necessárias para a consolidação da democracia
O desenvolvimento de redes de relacionamento por meio
no Brasil.
de computadores e a expansão da Internet abriram novas
PORQUE
perspectivas para a cultura, a comunicação e a educação.
Por meio da atuação de seus representantes nos Poderes
De acordo com as ideias do texto acima, a cibercultura Executivos e Legislativo, no decorrer do século XX,
passou a ser garantido no Brasil o direito de acesso à
A representa uma modalidade de cultura pós-moderna
educação, inclusive aos jovens e adultos que já estavam
de liberdade de comunicação e ação. fora da idade escolar.
B constituiu negação dos valores progressistas A respeito dessas asserções, assinale a opção correta.
defendidos pelos filósofos do Iluminismo. A As duas são proposições verdadeiras, e a segunda é
C banalizou a ciência ao disseminar o conhecimento nas uma justificativa correta da primeira.
B As duas são proposições verdadeiras, mas a segunda
redes sociais.
não é uma justificativa correta da primeira.
D valorizou o isolamento dos indivíduos pela produção
C A primeira é uma proposição verdadeira, e a segunda, falsa.
de softwares de codificação.
D A primeira é uma proposição falsa, e a segunda, verdadeira.
E incorpora valores do Iluminismo ao favorecer o E Tanto a primeira quanto a segunda asserções são
compartilhamento de informações e conhecimentos. proposições falsas.
3
ENGENHARIA GRUPO III *A0320113*
2011
EXAME NACIONAL DE DESEMPENHO DOS ESTUDANTES"
2011,5,OBJECTIVE,"questão).
5 - Use caneta esferográfica de tinta preta tanto para marcar as respostas das questões objetivas quanto para
escrever as respostas das questões discursivas.
6 - Não use calculadora; não se comunique com os demais estudantes nem troque material com eles; não
consulte material bibliográfico, cadernos ou anotações de qualquer espécie.
7 - Você terá quatro horas para responder às questões de múltipla escolha e discursivas e ao questionário de
percepção da prova.
8 - Quando terminar, entregue ao Aplicador ou Fiscal o seu Caderno de Respostas.
9 - Atenção! Você só poderá levar este Caderno de Prova após decorridas três horas do início do Exame.
Ministério
*A0320111*
da Educação
2011
FORMAÇÃO GERAL
EXAME NACIONAL DE DESEMPENHO DOS ESTUDANTES"
2011,6,OBJECTIVE,QUESTÃO 6
2011,7,OBJECTIVE,"QUESTÃO 7
A educação é o Xis da questão A definição de desenvolvimento sustentável mais
usualmente utilizada é a que procura atender às
necessidades atuais sem comprometer a capacidade das
Desemprego Salário
Aqui se vê que a taxa de Aqui se vê que os salários
desemprego é menor para aumentam conforme os gerações futuras. O mundo assiste a um questionamento
quem fica mais tempo anos de estudo (em reais)
na escola crescente de paradigmas estabelecidos na economia e
13,05%
Até 10 anos também na cultura política. A crise ambiental no planeta,
de estudo 18 500
Salário de quando traduzida na mudança climática, é uma ameaça real
7,91% quem tem
12 a 14 anos doutorado ao pleno desenvolvimento das potencialidades dos países.
ou MBA
de estudo
O Brasil está em uma posição privilegiada para enfrentar
os enormes desafios que se acumulam. Abriga elementos
8 600 3,83%
Salário de 15 a 17 anos fundamentais para o desenvolvimento: parte significativa
quem tem curso de estudo
superior e fala da biodiversidade e da água doce existentes no planeta;
uma língua 2,66%
estrangeira
Mais de grande extensão de terras cultiváveis; diversidade étnica e
1 800 17 anos
de estudo cultural e rica variedade de reservas naturais.
Salário de
quem conclui
o ensino
médio Fontes: Manager Assessoria O campo do desenvolvimento sustentável pode ser
em Recursos Humanos e IBGE
conceitualmente dividido em três componentes:
Disponível em: <http://ead.uepb.edu.br/noticias,82>. Acesso em: 24 ago. 2011. sustentabilidade ambiental, sustentabilidade econômica e
A expressão “o Xis da questão” usada no título do sustentabilidade sociopolítica.
infográfico diz respeito
Nesse contexto, o desenvolvimento sustentável pressupõe
A à quantidade de anos de estudos necessários para
garantir um emprego estável com salário digno.
A a preservação do equilíbrio global e do valor das
B às oportunidades de melhoria salarial que surgem à medida
reservas de capital natural, o que não justifica a
que aumenta o nível de escolaridade dos indivíduos.
C à influência que o ensino de língua estrangeira nas desaceleração do desenvolvimento econômico e
escolas tem exercido na vida profissional dos indivíduos. político de uma sociedade.
D aos questionamentos que são feitos acerca da
B a redefinição de critérios e instrumentos de
quantidade mínima de anos de estudo que os
indivíduos precisam para ter boa educação. avaliação de custo-benefício que reflitam os efeitos
E à redução da taxa de desemprego em razão da política socioeconômicos e os valores reais do consumo e da
atual de controle da evasão escolar e de aprovação
preservação.
automática de ano de acordo com a idade.
C o reconhecimento de que, apesar de os recursos
ÁREA LIVRE naturais serem ilimitados, deve ser traçado um
novo modelo de desenvolvimento econômico para a
humanidade.
D a redução do consumo das reservas naturais com
a consequente estagnação do desenvolvimento
econômico e tecnológico.
E a distribuição homogênea das reservas naturais entre
as nações e as regiões em nível global e regional.
5
ENGENHARIA GRUPO III *A0320115*
2011
EXAME NACIONAL DE DESEMPENHO DOS ESTUDANTES"
2011,8,OBJECTIVE,"QUESTÃO 8
Em reportagem, Owen Jones, autor do livro Chavs: a difamação da classe trabalhadora, publicado no Reino
Unido, comenta as recentes manifestações de rua em Londres e em outras principais cidades inglesas.
Jones prefere chamar atenção para as camadas sociais mais desfavorecidas do país, que desde o início dos
distúrbios, ficaram conhecidas no mundo todo pelo apelido chavs, usado pelos britânicos para escarnecer dos hábitos
de consumo da classe trabalhadora. Jones denuncia um sistemático abandono governamental dessa parcela da
população: “Os políticos insistem em culpar os indivíduos pela desigualdade”, diz. (...) “você não vai ver alguém assumir
ser um chav, pois se trata de um insulto criado como forma de generalizar o comportamento das classes mais baixas.
Meu medo não é o preconceito e, sim, a cortina de fumaça que ele oferece. Os distúrbios estão servindo como o
argumento ideal para que se faça valer a ideologia de que os problemas sociais são resultados de defeitos individuais,
não de falhas maiores. Trata-se de uma filosofia que tomou conta da sociedade britânica com a chegada de Margaret
Thatcher ao poder, em 1979, e que basicamente funciona assim: você é culpado pela falta de oportunidades. (...) Os
políticos insistem em culpar os indivíduos pela desigualdade”.
Suplemento Prosa & Verso, O Globo, Rio de Janeiro, 20 ago. 2011, p. 6 (adaptado).
Considerando as ideias do texto, avalie as afirmações a seguir.
I. Chavs é um apelido que exalta hábitos de consumo de parcela da população britânica.
II. Os distúrbios ocorridos na Inglaterra serviram para atribuir deslizes de comportamento individual como causas
de problemas sociais.
III. Indivíduos da classe trabalhadora britânica são responsabilizados pela falta de oportunidades decorrente da
ausência de políticas públicas.
IV. As manifestações de rua na Inglaterra reivindicavam formas de inclusão nos padrões de consumo vigente.
É correto apenas o que se afirma em
A I e II.
B I e IV.
C II e III.
D I, III e IV.
E II, III e IV.
ÁREA LIVRE
6
*A0320116* ENGENHARIA GRUPO III
2011
EXAME NACIONAL DE DESEMPENHO DOS ESTUDANTES"
2011,9,OBJECTIVE,QUESTÃO 9
2011,10,OBJECTIVE,"QUESTÃO 10 191 HB, utilizando o processo de torneamento. São
normalmente realizadas as operações de desbaste,
Um centro de pesquisas está projetando um tanque
acabamento e faceamento nas peças. As ferramentas de
cúbico para armazenar 4,76 kg de uma mistura
usinagem estão com baixa produtividade, apresentando
saturada de líquido-vapor a 169,6 oC com um título de
desgastes de flanco prematuros. No processo, foi
85% e cujo volume específico, nessas condições, é de,
verificado que estão sendo utilizadas ferramentas da
aproximadamente, 210 dm3/kg. A transferência de calor
Classe ISO P40, sem cobertura, sendo que os parâmetros
para o tanque desde o estado inicial, no qual a pressão da
mistura líquido-vapor saturada é 0,50 kgf/cm2, até o estado de corte estão de acordo com o catálogo do fornecedor.
final desejado, se dá a uma razão de 60 W. Necessita-se
Nessas condições de trabalho, a melhor estratégia para
dimensionar a altura do tanque cúbico a ser construído.
aumentar a produtividade do processo e minimizar o
Considerando que o calor total transferido para o tanque desgaste das ferramentas é
durante o aquecimento foi de 9 117 kJ, concluiu-se
A utilizar fluido de corte emulsionável.
que a altura do tanque e o tempo do processo são,
B usar ferramenta da Classe ISO K40, sem cobertura.
respectivamente, iguais a
C usar ferramenta da Classe ISO K10, com revestimento
A 1,0 m e 42,2 horas.
de TiN.
B 1,0 m e 152,0 horas.
D usar ferramenta da classe ISO M40, sem cobertura
C 1,0 m e 422,0 horas. de TiN.
D 10,0 m e 42,2 horas. E diminuir os parâmetros de corte (velocidade de corte
E 10,0 m e 152,0 horas. e avanço).
9
ENGENHARIA GRUPO III *A0320119*
2011
EXAME NACIONAL DE DESEMPENHO DOS ESTUDANTES"
2011,11,OBJECTIVE,"QUESTÃO 11
Uma empresa prestadora de serviços de limpeza de
tubos e tanques da indústria petrolífera utiliza uma bomba
hidráulica de alta vazão, acionada por um motor diesel de
400 Hp. O acoplamento entre o motor e a bomba é feito
por um sistema de corrente, no qual o diâmetro primitivo da
polia acoplada ao motor é d , o da polia acoplada ao eixo da
1
bomba é d e a distância entre os centros do conjunto é H.
2
Preocupado com os problemas causados pela aplicação
desse sistema, o gerente da empresa solicitou um estudo
da viabilidade de substituir a transmissão de corrente Uma bomba de água é movida por um motor elétrico de
por um par de engrenagens, sem alterar a montagem do 18 kW, cuja eficiência é de 90%. A vazão é de 40 litros por
conjunto. O engenheiro encarregado iniciou o estudo de segundo. O diâmetro na tubulação é constante, a diferença
viabilidade pela definição das exigências da cinemática das cotas entre os pontos (1) e (2) é desprezível e a perda de
do engrenamento, envolvendo o número de dentes da carga entre esses pontos corresponde a 5 m. As pressões
engrenagem que seria acoplada ao eixo do motor (Z ), o manométricas na entrada e na saída são, respectivamente,
1
número de dentes da engrenagem que seria acoplada de 150 kPa e 400 kPa.
ao eixo da bomba (Z 2 ) e o módulo a ser selecionado (m). Considerando o peso específico da água δ = 10 000 N/m3
Ele escreveu as seguintes relações:
e a aceleração da gravidade g = 10 m/s2, conclui-se que a
eficiência da bomba é de
I.
II. e A 40%.
III. B 50%.
É correto apenas o que se afirma em C 62%.
D 74%.
A I.
E 90%.
B II.
C I e II."
2011,12,OBJECTIVE,"QUESTÃO 12
D I e III.
E II e III. Uma empresa produz diariamente 650 buchas de ferro
fundido cinzento da classe FE-45012, com dureza de"
2011,13,OBJECTIVE,QUESTÃO 13
2011,14,OBJECTIVE,"QUESTÃO 14
O coeficiente de arrasto de um disco com um escoamento As usinas termelétricas geram eletricidade a partir de
normal a uma de suas faces é Cd = 1,17, para valores do turbinas movidas a vapor. O ciclo de Rankine é um ciclo
número de Reynolds maiores do que 1 000. termodinâmico ideal que pode ser utilizado para modelar,
de forma simplificada, uma usina termelétrica. A figura
FOX, R. W., MCDONALD, A. T., PRITCHARD, P. Introduction to Fluid Mechanics. abaixo mostra de forma esquemática os elementos
6. ed. New York: Willey International, 2004. p. 787 (com adaptações)
básicos de um ciclo de Rankine simples ideal.
Em um experimento tem-se água escoando normal à
Entrada
face de um disco. A força de arraste da água no disco é de calor
de alguma forma determinada. Repete-se o experimento
Caldeira
com duas modificações, utiliza-se ar como fluido e altera-
se a velocidade do escoamento para garantir que nos
dois experimentos o número de Reynolds seja o mesmo Saída de
e superior a 1000. A força de arraste da ar no disco é, Trabalho
também, de alguma forma determinada. Considere que a Turbina
água com kg/m3 e Pa.s, e considere
o ar com kg / m3 e Pa.s. Bomba
Com relação às forças que atuam nesse experimento,
é correto afirmar que Entrada
de trabalho
Condensador Saída
A a força de arrasto será a mesma nos dois experimentos, de calor
pois o número de Reynolds e o coeficiente de arrasto
são os mesmos; e a força de empuxo será maior no
experimento com água.
Considerando que algumas usinas termelétricas que
B a força de arrasto será maior no experimento com
utilizam turbinas a vapor podem ser encontradas próximas
água, no qual a velocidade do fluido é menor; e a força
a grandes reservatórios de água, como rios e lagos,
de empuxo é maior no experimento com água. analise as seguintes afirmações.
C a força de arrasto será maior no experimento com
I. O ciclo de Rankine simples mostrado na figura
água, no qual a velocidade do fluido é menor; e a força
não prevê a reutilização da energia que é rejeitada
de empuxo será menor no experimento com água.
no condensador e, por isso, tem um rendimento
D a força de arrasto será maior no experimento com comparável ao de um ciclo de Carnot que opera
água, no qual a velocidade do fluido é maior; e a força entre as mesmas temperaturas.
de empuxo será maior no experimento com água. II. Historicamente, a instalação de algumas
E a força de arrasto será menor no experimento com usinas próximas a grandes rios se dá devido
à necessidade de remover calor do ciclo, por
água, no qual a velocidade do fluido é maior; e a força
intermédio da transferência de calor que ocorre
de empuxo será menor no experimento com água.
no condensador, porém com implicações ao meio
ambiente.
ÁREA LIVRE III. Em usinas que utilizam combustíveis fósseis, o
vapor gerado na caldeira é contaminado pelos
gases da combustão e não é reaproveitado no
ciclo, sendo mais econômico rejeitá-lo, causando
impacto ambiental.
IV. Entre as termelétricas, as usinas nucleares são
as únicas que não causam impacto ambiental,
exceto pela necessidade de se armazenar o lixo
nuclear gerado.
É correto apenas o que se afirma em
A I.
B II.
C I e III.
D II e IV.
E II, III e IV.
10
*A03201110* ENGENHARIA GRUPO III
2011
EXAME NACIONAL DE DESEMPENHO DOS ESTUDANTES"
2011,15,OBJECTIVE,QUESTÃO 15
2011,16,OBJECTIVE,"QUESTÃO 16
Em um ensaio de resposta em frequência de uma
A figura abaixo representa um sistema de refrigeração por
suspensão veicular, foi realizada uma varredura em
compressão de vapor com seus principais componentes e frequência, tendo sido o sistema excitado com uma força
seu respectivo ciclo teórico, construído sobre um diagrama do tipo F = F .cos(ωt). Para cada frequência com que
o
se excitou a estrutura, mediu-se o deslocamento x(ω),
de Mollier (P-h).
resultando no gráfico de resposta de frequência mostrado
a seguir.
H( )(m/N)
1,80E-03
H( )=
X_(__)
1,60E-03 F( )
1,40E-03
1,20E-03
E,00E-03
8,00E-04
6,00E-04
4,00E-04
2,00E-04
0,00E+00
0 10 20 30 40 50 60
(rad/s)
Modelando a suspensão como um sistema massa–mola
de um grau de liberdade, a equação matemática para a
resposta em frequência é
H( ) ___
( ) )
DOSSAT, R. Princípios de Refrigeracion. Mexico: Compañia Editorial
Continental S/A, 1980,p. 130 (com adaptações).
Observando os processos termodinâmicos que constituem
o ciclo teórico, analise as afirmações que se seguem.
I. é um processo adiabático e reversível com
aumento de temperatura e pressão.
II. é um processo isotérmico com pressão
constante.
III. é um processo isentálpico com expansão
reversível.
É correto o que se afirma em
A I, apenas.
B II, apenas.
C I e III, apenas.
D II e III, apenas.
E I, II e III.
11
ENGENHARIA GRUPO III
)
1
k m 2 2 c 2
em que k, c e m são os parâmetros que caracterizam a
estrutura, a saber, constante elástica, amortecimento
e massa, respectivamente. Analisando-se o gráfico e
usando a equação da resposta em frequência, é possível
identificar o valor da frequência de ressonância da
estrutura (ω ) e calcular os parâmetros k, c, e m.
n
Nessa situação, quais os valores corretos desses parâmetros?
A ω = 11 rad/s; k = 500 N/m; m = 4,132 kg e c = 56,82 Ns/m.
n
B ω = 11 rad/s; k = 500 N/m; m = 41,32 kg e c = 5,20 Ns/m.
n
C ω = 11 rad/s; k = 5 000 N/m; m = 41,32 kg e c = 56,82 Ns/m.
n
D ω = 12 rad/s; k = 5 000 N/m; m = 34,72 kg e c = 5,20 Ns/m.
n
E ω = 12 rad/s; k = 5 000 N/m; m = 34,72 kg e c = 52,08 Ns/m.
n
ÁREA LIVRE
*A03201111*
2011
EXAME NACIONAL DE DESEMPENHO DOS ESTUDANTES"
2011,17,OBJECTIVE,QUESTÃO 17
2011,18,OBJECTIVE,"QUESTÃO 18
A segunda lei da termodinâmica pode ser usada para O petróleo é retirado das jazidas por meio de perfurações
na crosta terrestre, através das quais se atinge o poço
avaliar propostas de construção de equipamentos e
petrolífero. Inicialmente, o petróleo jorra espontaneamente,
verifi car se o projeto é factível, ou seja, se é possível de
em razão da grande pressão de seus gases. Uma empresa
ser construído. Considere a situação em que um inventor
especializada em perfurar poços foi contratada para
alega ter desenvolvido um equipamento que trabalha pesquisar a existência de petróleo em uma região. Durante
segundo o ciclo termodinâmico de potência mostrado na o processo de perfuração, verifi cou-se que, ao atingir 100 m
fi gura. O equipamento retira 800 kJ de energia, na forma de profundidade, o poço jorra petróleo espontaneamente a
uma altura h = 18 m acima do solo. A empresa pede para
de calor, de um dado local que se encontra na temperatura
um especialista fazer uma análise desse problema clássico.
de 1000 K, desenvolve uma dada quantidade líquida de
Após esquematizar o problema conforme fi gura abaixo, ele
trabalho para a elevação de um peso e descarta 300 kJ
considera razoável admitir que as perdas por atrito com o
de energia, na forma de calor, para outro local que se ar são em torno de 10% da carga total do jato de petróleo
encontra a 500 K de temperatura. A efi ciência térmica do na saída do poço.
ciclo é dada pela equação fornecida.
Poço de extração de petróleo.
MORAN, M. J., SHAPIRO, H. N. Princípios de Termodinâmica para
Engenharia. Editora LTC S.A., Rio de Janeiro, 6ª edição, 2009, Cap. 5. Dados:
Nessa situação, a alegação do inventor é Aceleração da gravidade g = 10 m/s2.
A correta, pois a efi ciência de seu equipamento é de Área da seção do poço = 5 cm2.
50% e é menor que a efi ciência teórica máxima. Perda de carga no trecho 2-3 é equivalente a 50 m.
B incorreta, pois a efi ciência de seu equipamento é de Considerando os resultados obtidos pelo especialista, a
50% e é maior do que a efi ciência teórica máxima. partir de uma análise quantitativa, conclui-se que a vazão
volumétrica na saída do poço de petróleo e a pressão P2
C correta, pois a efi ciência de seu equipamento é de
na entrada do poço são, respectivamente, iguais a
62,5% e é menor do que a efi ciência teórica máxima.
A 0,1 m3/s e -4,0 kgf/cm2.
D incorreta, pois a efi ciência de seu equipamento é de
B 0,1 m3/s e 12,0 kgf/cm2.
62,5% e é maior do que a efi ciência teórica máxima.
C 0,1 m3/s e 8,0 kgf/cm2.
E incorreta, pois a efi ciência de seu equipamento é de D 1 m3/s e -4,0 kgf/cm2.
62,5% e é menor do que a efi ciência teórica máxima. E 1 m3/s e 12,0 kgf/cm2.
12
*A03201112* ENGENHARIA GRUPO III
2011
EXAME NACIONAL DE DESEMPENHO DOS ESTUDANTES"
